{
    "cloudPool": {
      "name": "my-scaling-group",
      "driverConfig": { 
        "keystoneEndpoint": "http://openstack.nova.com:5000/v2.0",
        "region": "RegionOne",
        "tenantName": "tenant",
        "userName": "clouduser",
        "password": "cloudpass"
      }      
    },
    "scaleOutConfig": {
      "size": "m1.small", 
      "image": "Ubuntu Server 12.04",
      "keyPair": "openstack_p11",
      "securityGroups": ["web"],               
      "bootScript": [
        "sudo apt-get update",
        "sudo apt-get install -y --force-yes apache2"
      ]
    },
    "scaleInConfig": {
      "victimSelectionPolicy": "CLOSEST_TO_INSTANCE_HOUR",
      "instanceHourMargin": 0
    },
    "alerts": {
      "subject": "[elastisys:scale] alert for scaling group 'my-scaling-group'",
      "recipients": ["recipient@elastisys.com"],
      "sender": "noreply@elastisys.com",
      "mailServer": {
        "smtpHost": "mail.elastisys.com",
        "smtpPort": 25,
        "authentication": {"userName": "user", "password": "password"},
        "useSsl": true
      }
    },    
    "poolUpdatePeriod": 180       
}  